[
  {
    "schema_version": "2020-12",
    "segment_id": "seg_001",
    "encounter_id": "SYN_OUT_005",
    "start_time": 0.0,
    "end_time": 3.0,
    "speaker_id": "speaker_0",
    "speaker_role": "doctor",
    "text": "Chào chị, hôm nay chị khó chịu ở đâu?",
    "confidence": 1.0,
    "audio_span": { "start_time": 0.0, "end_time": 3.0 },
    "contains_phi": "no_or_simulated",
    "role_label_source": "synthetic_gold",
    "segment_status": "reviewed",
    "created_at": "2026-06-02T00:00:00+07:00",
    "version": "v0.1.0"
  },
  {
    "schema_version": "2020-12",
    "segment_id": "seg_002",
    "encounter_id": "SYN_OUT_005",
    "start_time": 3.1,
    "end_time": 8.0,
    "speaker_id": "speaker_1",
    "speaker_role": "patient",
    "text": "Dạ em đau vùng trên rốn, hơi lệch giữa, từ tối qua đến giờ.",
    "confidence": 1.0,
    "audio_span": { "start_time": 3.1, "end_time": 8.0 },
    "contains_phi": "no_or_simulated",
    "role_label_source": "synthetic_gold",
    "segment_status": "reviewed",
    "created_at": "2026-06-02T00:00:00+07:00",
    "version": "v0.1.0"
  },
  {
    "schema_version": "2020-12",
    "segment_id": "seg_003",
    "encounter_id": "SYN_OUT_005",
    "start_time": 8.1,
    "end_time": 11.0,
    "speaker_id": "speaker_0",
    "speaker_role": "doctor",
    "text": "Chị có buồn nôn hoặc nôn không?",
    "confidence": 1.0,
    "audio_span": { "start_time": 8.1, "end_time": 11.0 },
    "contains_phi": "no_or_simulated",
    "role_label_source": "synthetic_gold",
    "segment_status": "reviewed",
    "created_at": "2026-06-02T00:00:00+07:00",
    "version": "v0.1.0"
  },
  {
    "schema_version": "2020-12",
    "segment_id": "seg_004",
    "encounter_id": "SYN_OUT_005",
    "start_time": 11.1,
    "end_time": 14.0,
    "speaker_id": "speaker_1",
    "speaker_role": "patient",
    "text": "Dạ em buồn nôn nhưng không nôn.",
    "confidence": 1.0,
    "audio_span": { "start_time": 11.1, "end_time": 14.0 },
    "contains_phi": "no_or_simulated",
    "role_label_source": "synthetic_gold",
    "segment_status": "reviewed",
    "created_at": "2026-06-02T00:00:00+07:00",
    "version": "v0.1.0"
  },
  {
    "schema_version": "2020-12",
    "segment_id": "seg_005",
    "encounter_id": "SYN_OUT_005",
    "start_time": 14.1,
    "end_time": 17.0,
    "speaker_id": "speaker_0",
    "speaker_role": "doctor",
    "text": "Chị có nôn ra máu không?",
    "confidence": 1.0,
    "audio_span": { "start_time": 14.1, "end_time": 17.0 },
    "contains_phi": "no_or_simulated",
    "role_label_source": "synthetic_gold",
    "segment_status": "reviewed",
    "created_at": "2026-06-02T00:00:00+07:00",
    "version": "v0.1.0"
  },
  {
    "schema_version": "2020-12",
    "segment_id": "seg_006",
    "encounter_id": "SYN_OUT_005",
    "start_time": 17.1,
    "end_time": 20.0,
    "speaker_id": "speaker_1",
    "speaker_role": "patient",
    "text": "Dạ không, em không nôn ra máu.",
    "confidence": 1.0,
    "audio_span": { "start_time": 17.1, "end_time": 20.0 },
    "contains_phi": "no_or_simulated",
    "role_label_source": "synthetic_gold",
    "segment_status": "reviewed",
    "created_at": "2026-06-02T00:00:00+07:00",
    "version": "v0.1.0"
  },
  {
    "schema_version": "2020-12",
    "segment_id": "seg_007",
    "encounter_id": "SYN_OUT_005",
    "start_time": 20.1,
    "end_time": 24.0,
    "speaker_id": "speaker_0",
    "speaker_role": "doctor",
    "text": "Chị đi ngoài có máu hoặc phân đen không?",
    "confidence": 1.0,
    "audio_span": { "start_time": 20.1, "end_time": 24.0 },
    "contains_phi": "no_or_simulated",
    "role_label_source": "synthetic_gold",
    "segment_status": "reviewed",
    "created_at": "2026-06-02T00:00:00+07:00",
    "version": "v0.1.0"
  },
  {
    "schema_version": "2020-12",
    "segment_id": "seg_008",
    "encounter_id": "SYN_OUT_005",
    "start_time": 24.1,
    "end_time": 29.0,
    "speaker_id": "speaker_1",
    "speaker_role": "patient",
    "text": "Dạ không, em không đi ngoài ra máu và cũng không có phân đen.",
    "confidence": 1.0,
    "audio_span": { "start_time": 24.1, "end_time": 29.0 },
    "contains_phi": "no_or_simulated",
    "role_label_source": "synthetic_gold",
    "segment_status": "reviewed",
    "created_at": "2026-06-02T00:00:00+07:00",
    "version": "v0.1.0"
  },
  {
    "schema_version": "2020-12",
    "segment_id": "seg_009",
    "encounter_id": "SYN_OUT_005",
    "start_time": 29.1,
    "end_time": 33.0,
    "speaker_id": "speaker_0",
    "speaker_role": "doctor",
    "text": "Chị có sốt hoặc đau bụng dữ dội không?",
    "confidence": 1.0,
    "audio_span": { "start_time": 29.1, "end_time": 33.0 },
    "contains_phi": "no_or_simulated",
    "role_label_source": "synthetic_gold",
    "segment_status": "reviewed",
    "created_at": "2026-06-02T00:00:00+07:00",
    "version": "v0.1.0"
  },
  {
    "schema_version": "2020-12",
    "segment_id": "seg_010",
    "encounter_id": "SYN_OUT_005",
    "start_time": 33.1,
    "end_time": 37.0,
    "speaker_id": "speaker_1",
    "speaker_role": "patient",
    "text": "Dạ không sốt, đau âm ỉ thôi chứ không dữ dội.",
    "confidence": 1.0,
    "audio_span": { "start_time": 33.1, "end_time": 37.0 },
    "contains_phi": "no_or_simulated",
    "role_label_source": "synthetic_gold",
    "segment_status": "reviewed",
    "created_at": "2026-06-02T00:00:00+07:00",
    "version": "v0.1.0"
  },
  {
    "schema_version": "2020-12",
    "segment_id": "seg_011",
    "encounter_id": "SYN_OUT_005",
    "start_time": 37.1,
    "end_time": 40.0,
    "speaker_id": "speaker_0",
    "speaker_role": "doctor",
    "text": "Trước đây chị có dị ứng thuốc gì không?",
    "confidence": 1.0,
    "audio_span": { "start_time": 37.1, "end_time": 40.0 },
    "contains_phi": "no_or_simulated",
    "role_label_source": "synthetic_gold",
    "segment_status": "reviewed",
    "created_at": "2026-06-02T00:00:00+07:00",
    "version": "v0.1.0"
  },
  {
    "schema_version": "2020-12",
    "segment_id": "seg_012",
    "encounter_id": "SYN_OUT_005",
    "start_time": 40.1,
    "end_time": 43.0,
    "speaker_id": "speaker_1",
    "speaker_role": "patient",
    "text": "Dạ em chưa từng dị ứng thuốc.",
    "confidence": 1.0,
    "audio_span": { "start_time": 40.1, "end_time": 43.0 },
    "contains_phi": "no_or_simulated",
    "role_label_source": "synthetic_gold",
    "segment_status": "reviewed",
    "created_at": "2026-06-02T00:00:00+07:00",
    "version": "v0.1.0"
  },
  {
    "schema_version": "2020-12",
    "segment_id": "seg_013",
    "encounter_id": "SYN_OUT_005",
    "start_time": 43.1,
    "end_time": 48.0,
    "speaker_id": "speaker_0",
    "speaker_role": "doctor",
    "text": "Chị có đang dùng thuốc giảm đau hoặc thuốc dạ dày nào không?",
    "confidence": 1.0,
    "audio_span": { "start_time": 43.1, "end_time": 48.0 },
    "contains_phi": "no_or_simulated",
    "role_label_source": "synthetic_gold",
    "segment_status": "reviewed",
    "created_at": "2026-06-02T00:00:00+07:00",
    "version": "v0.1.0"
  },
  {
    "schema_version": "2020-12",
    "segment_id": "seg_014",
    "encounter_id": "SYN_OUT_005",
    "start_time": 48.1,
    "end_time": 52.0,
    "speaker_id": "speaker_1",
    "speaker_role": "patient",
    "text": "Dạ em chưa uống thuốc gì, chỉ uống nước ấm.",
    "confidence": 1.0,
    "audio_span": { "start_time": 48.1, "end_time": 52.0 },
    "contains_phi": "no_or_simulated",
    "role_label_source": "synthetic_gold",
    "segment_status": "reviewed",
    "created_at": "2026-06-02T00:00:00+07:00",
    "version": "v0.1.0"
  },
  {
    "schema_version": "2020-12",
    "segment_id": "seg_015",
    "encounter_id": "SYN_OUT_005",
    "start_time": 52.1,
    "end_time": 68.0,
    "speaker_id": "speaker_0",
    "speaker_role": "doctor",
    "text": "Tạm thời chị ăn nhẹ, tránh đồ cay chua, theo dõi thêm. Nếu đau tăng, nôn ra máu, đi ngoài ra máu, phân đen hoặc choáng thì cần đi khám ngay.",
    "confidence": 1.0,
    "audio_span": { "start_time": 52.1, "end_time": 68.0 },
    "contains_phi": "no_or_simulated",
    "role_label_source": "synthetic_gold",
    "segment_status": "reviewed",
    "created_at": "2026-06-02T00:00:00+07:00",
    "version": "v0.1.0"
  },
  {
    "schema_version": "2020-12",
    "segment_id": "seg_016",
    "encounter_id": "SYN_OUT_005",
    "start_time": 68.1,
    "end_time": 72.0,
    "speaker_id": "speaker_1",
    "speaker_role": "patient",
    "text": "Dạ vâng.",
    "confidence": 1.0,
    "audio_span": { "start_time": 68.1, "end_time": 72.0 },
    "contains_phi": "no_or_simulated",
    "role_label_source": "synthetic_gold",
    "segment_status": "reviewed",
    "created_at": "2026-06-02T00:00:00+07:00",
    "version": "v0.1.0"
  }
]
