[
    {
        "segment_id": "seg_001",
        "encounter_id": "SYN_OUT_006",
        "start_time": 0.0,
        "end_time": 3.0,
        "speaker_id": "Speaker_0",
        "speaker_role": "doctor",
        "text": "Chào anh, hôm nay anh đi khám vì vấn đề gì?",
        "confidence": 1.0,
        "audio_span": {
            "start_time": 0.0,
            "end_time": 3.0
        },
        "created_at": "2026-06-03T00:00:00+07:00",
        "version": "v0.1.0"
    },
    {
        "segment_id": "seg_002",
        "encounter_id": "SYN_OUT_006",
        "start_time": 3.1,
        "end_time": 9.0,
        "speaker_id": "Speaker_0",
        "speaker_role": "doctor",
        "text": "Dạ mấy hôm nay em hay hồi hộp và thấy khó chịu vùng ngực khi căng thẳng.",
        "confidence": 1.0,
        "audio_span": {
            "start_time": 3.1,
            "end_time": 9.0
        },
        "created_at": "2026-06-03T00:00:00+07:00",
        "version": "v0.1.0"
    },
    {
        "segment_id": "seg_003",
        "encounter_id": "SYN_OUT_006",
        "start_time": 9.1,
        "end_time": 12.0,
        "speaker_id": "Speaker_0",
        "speaker_role": "doctor",
        "text": "Anh mô tả rõ hơn được không, có phải đau ngực không?",
        "confidence": 1.0,
        "audio_span": {
            "start_time": 9.1,
            "end_time": 12.0
        },
        "created_at": "2026-06-03T00:00:00+07:00",
        "version": "v0.1.0"
    },
    {
        "segment_id": "seg_004",
        "encounter_id": "SYN_OUT_006",
        "start_time": 12.1,
        "end_time": 18.0,
        "speaker_id": "Speaker_0",
        "speaker_role": "doctor",
        "text": "Dạ không phải đau ngực. Em chỉ thấy tức nhẹ khi lo lắng, nghỉ một lúc thì đỡ.",
        "confidence": 1.0,
        "audio_span": {
            "start_time": 12.1,
            "end_time": 18.0
        },
        "created_at": "2026-06-03T00:00:00+07:00",
        "version": "v0.1.0"
    },
    {
        "segment_id": "seg_005",
        "encounter_id": "SYN_OUT_006",
        "start_time": 18.1,
        "end_time": 21.0,
        "speaker_id": "Speaker_0",
        "speaker_role": "doctor",
        "text": "Anh có khó thở không?",
        "confidence": 1.0,
        "audio_span": {
            "start_time": 18.1,
            "end_time": 21.0
        },
        "created_at": "2026-06-03T00:00:00+07:00",
        "version": "v0.1.0"
    },
    {
        "segment_id": "seg_006",
        "encounter_id": "SYN_OUT_006",
        "start_time": 21.1,
        "end_time": 24.0,
        "speaker_id": "Speaker_0",
        "speaker_role": "doctor",
        "text": "Dạ không, em không khó thở.",
        "confidence": 1.0,
        "audio_span": {
            "start_time": 21.1,
            "end_time": 24.0
        },
        "created_at": "2026-06-03T00:00:00+07:00",
        "version": "v0.1.0"
    },
    {
        "segment_id": "seg_007",
        "encounter_id": "SYN_OUT_006",
        "start_time": 24.1,
        "end_time": 30.0,
        "speaker_id": "Speaker_0",
        "speaker_role": "doctor",
        "text": "Cơn khó chịu có lan lên hàm, lan ra tay trái hoặc vã mồ hôi lạnh không?",
        "confidence": 1.0,
        "audio_span": {
            "start_time": 24.1,
            "end_time": 30.0
        },
        "created_at": "2026-06-03T00:00:00+07:00",
        "version": "v0.1.0"
    },
    {
        "segment_id": "seg_008",
        "encounter_id": "SYN_OUT_006",
        "start_time": 30.1,
        "end_time": 35.0,
        "speaker_id": "Speaker_0",
        "speaker_role": "doctor",
        "text": "Dạ không lan lên hàm, không lan ra tay trái và không vã mồ hôi lạnh.",
        "confidence": 1.0,
        "audio_span": {
            "start_time": 30.1,
            "end_time": 35.0
        },
        "created_at": "2026-06-03T00:00:00+07:00",
        "version": "v0.1.0"
    },
    {
        "segment_id": "seg_009",
        "encounter_id": "SYN_OUT_006",
        "start_time": 35.1,
        "end_time": 39.0,
        "speaker_id": "Speaker_0",
        "speaker_role": "doctor",
        "text": "Anh có từng ngất, choáng nhiều hoặc yếu liệt tay chân không?",
        "confidence": 1.0,
        "audio_span": {
            "start_time": 35.1,
            "end_time": 39.0
        },
        "created_at": "2026-06-03T00:00:00+07:00",
        "version": "v0.1.0"
    },
    {
        "segment_id": "seg_010",
        "encounter_id": "SYN_OUT_006",
        "start_time": 39.1,
        "end_time": 45.0,
        "speaker_id": "Speaker_0",
        "speaker_role": "doctor",
        "text": "Dạ không ngất, không yếu liệt tay chân. Thỉnh thoảng em chỉ hơi run tay khi lo.",
        "confidence": 1.0,
        "audio_span": {
            "start_time": 39.1,
            "end_time": 45.0
        },
        "created_at": "2026-06-03T00:00:00+07:00",
        "version": "v0.1.0"
    },
    {
        "segment_id": "seg_011",
        "encounter_id": "SYN_OUT_006",
        "start_time": 45.1,
        "end_time": 48.0,
        "speaker_id": "Speaker_0",
        "speaker_role": "doctor",
        "text": "Gần đây anh ngủ và làm việc thế nào?",
        "confidence": 1.0,
        "audio_span": {
            "start_time": 45.1,
            "end_time": 48.0
        },
        "created_at": "2026-06-03T00:00:00+07:00",
        "version": "v0.1.0"
    },
    {
        "segment_id": "seg_012",
        "encounter_id": "SYN_OUT_006",
        "start_time": 48.1,
        "end_time": 54.0,
        "speaker_id": "Speaker_0",
        "speaker_role": "doctor",
        "text": "Em ngủ ít, công việc áp lực, mỗi ngày uống hai đến ba ly cà phê.",
        "confidence": 1.0,
        "audio_span": {
            "start_time": 48.1,
            "end_time": 54.0
        },
        "created_at": "2026-06-03T00:00:00+07:00",
        "version": "v0.1.0"
    },
    {
        "segment_id": "seg_013",
        "encounter_id": "SYN_OUT_006",
        "start_time": 54.1,
        "end_time": 71.0,
        "speaker_id": "Speaker_0",
        "speaker_role": "doctor",
        "text": "Trước mắt anh nên giảm cà phê, ngủ đủ hơn, theo dõi triệu chứng. Nếu xuất hiện đau ngực thật sự, khó thở, ngất, vã mồ hôi lạnh hoặc đau lan tay trái thì cần đi khám cấp cứu.",
        "confidence": 1.0,
        "audio_span": {
            "start_time": 54.1,
            "end_time": 71.0
        },
        "created_at": "2026-06-03T00:00:00+07:00",
        "version": "v0.1.0"
    },
    {
        "segment_id": "seg_014",
        "encounter_id": "SYN_OUT_006",
        "start_time": 71.1,
        "end_time": 75.0,
        "speaker_id": "Speaker_0",
        "speaker_role": "doctor",
        "text": "Dạ vâng, em sẽ theo dõi.",
        "confidence": 1.0,
        "audio_span": {
            "start_time": 71.1,
            "end_time": 75.0
        },
        "created_at": "2026-06-03T00:00:00+07:00",
        "version": "v0.1.0"
    }
]