[
    {
        "segment_id": "seg_001",
        "encounter_id": "SYN_OUT_002",
        "start_time": 0.0,
        "end_time": 3.1,
        "speaker_id": "Speaker_0",
        "speaker_role": "doctor",
        "text": "Ch\u00e0o ch\u1ecb, h\u00f4m nay ch\u1ecb \u0111i kh\u00e1m v\u00ec v\u1ea5n \u0111\u1ec1 g\u00ec?",
        "confidence": 1.0,
        "audio_span": {
            "start_time": 0.0,
            "end_time": 3.1
        },
        "created_at": "2026-06-02T00:00:00+07:00",
        "version": "v0.1.0"
    },
    {
        "segment_id": "seg_002",
        "encounter_id": "SYN_OUT_002",
        "start_time": 3.2,
        "end_time": 7.4,
        "speaker_id": "Speaker_1",
        "speaker_role": "patient",
        "text": "D\u1ea1 em b\u1ecb \u0111au b\u1ee5ng v\u00e0 \u0111i ngo\u00e0i l\u1ecfng kho\u1ea3ng hai ng\u00e0y nay.",
        "confidence": 1.0,
        "audio_span": {
            "start_time": 3.2,
            "end_time": 7.4
        },
        "created_at": "2026-06-02T00:00:00+07:00",
        "version": "v0.1.0"
    },
    {
        "segment_id": "seg_003",
        "encounter_id": "SYN_OUT_002",
        "start_time": 7.5,
        "end_time": 9.7,
        "speaker_id": "Speaker_0",
        "speaker_role": "doctor",
        "text": "Ch\u1ecb \u0111au b\u1ee5ng \u1edf v\u1ecb tr\u00ed n\u00e0o?",
        "confidence": 1.0,
        "audio_span": {
            "start_time": 7.5,
            "end_time": 9.7
        },
        "created_at": "2026-06-02T00:00:00+07:00",
        "version": "v0.1.0"
    },
    {
        "segment_id": "seg_004",
        "encounter_id": "SYN_OUT_002",
        "start_time": 9.8,
        "end_time": 14.2,
        "speaker_id": "Speaker_1",
        "speaker_role": "patient",
        "text": "Em \u0111au quanh r\u1ed1n, \u0111au t\u1eebng c\u01a1n ch\u1ee9 kh\u00f4ng \u0111au li\u00ean t\u1ee5c.",
        "confidence": 1.0,
        "audio_span": {
            "start_time": 9.8,
            "end_time": 14.2
        },
        "created_at": "2026-06-02T00:00:00+07:00",
        "version": "v0.1.0"
    },
    {
        "segment_id": "seg_005",
        "encounter_id": "SYN_OUT_002",
        "start_time": 14.3,
        "end_time": 17.0,
        "speaker_id": "Speaker_0",
        "speaker_role": "doctor",
        "text": "M\u1ed9t ng\u00e0y ch\u1ecb \u0111i ngo\u00e0i kho\u1ea3ng m\u1ea5y l\u1ea7n?",
        "confidence": 1.0,
        "audio_span": {
            "start_time": 14.3,
            "end_time": 17.0
        },
        "created_at": "2026-06-02T00:00:00+07:00",
        "version": "v0.1.0"
    },
    {
        "segment_id": "seg_006",
        "encounter_id": "SYN_OUT_002",
        "start_time": 17.1,
        "end_time": 20.6,
        "speaker_id": "Speaker_1",
        "speaker_role": "patient",
        "text": "D\u1ea1 kho\u1ea3ng b\u1ed1n \u0111\u1ebfn n\u0103m l\u1ea7n m\u1ed9t ng\u00e0y.",
        "confidence": 1.0,
        "audio_span": {
            "start_time": 17.1,
            "end_time": 20.6
        },
        "created_at": "2026-06-02T00:00:00+07:00",
        "version": "v0.1.0"
    },
    {
        "segment_id": "seg_007",
        "encounter_id": "SYN_OUT_002",
        "start_time": 20.7,
        "end_time": 24.0,
        "speaker_id": "Speaker_0",
        "speaker_role": "doctor",
        "text": "Ph\u00e2n c\u00f3 m\u00e1u ho\u1eb7c c\u00f3 m\u00e0u \u0111en b\u1ea5t th\u01b0\u1eddng kh\u00f4ng?",
        "confidence": 1.0,
        "audio_span": {
            "start_time": 20.7,
            "end_time": 24.0
        },
        "created_at": "2026-06-02T00:00:00+07:00",
        "version": "v0.1.0"
    },
    {
        "segment_id": "seg_008",
        "encounter_id": "SYN_OUT_002",
        "start_time": 24.1,
        "end_time": 28.2,
        "speaker_id": "Speaker_1",
        "speaker_role": "patient",
        "text": "D\u1ea1 kh\u00f4ng, em kh\u00f4ng th\u1ea5y m\u00e1u v\u00e0 c\u0169ng kh\u00f4ng th\u1ea5y ph\u00e2n \u0111en.",
        "confidence": 1.0,
        "audio_span": {
            "start_time": 24.1,
            "end_time": 28.2
        },
        "created_at": "2026-06-02T00:00:00+07:00",
        "version": "v0.1.0"
    },
    {
        "segment_id": "seg_009",
        "encounter_id": "SYN_OUT_002",
        "start_time": 28.3,
        "end_time": 32.0,
        "speaker_id": "Speaker_0",
        "speaker_role": "doctor",
        "text": "Ch\u1ecb c\u00f3 s\u1ed1t cao, n\u00f4n nhi\u1ec1u ho\u1eb7c n\u00f4n ra m\u00e1u kh\u00f4ng?",
        "confidence": 1.0,
        "audio_span": {
            "start_time": 28.3,
            "end_time": 32.0
        },
        "created_at": "2026-06-02T00:00:00+07:00",
        "version": "v0.1.0"
    },
    {
        "segment_id": "seg_010",
        "encounter_id": "SYN_OUT_002",
        "start_time": 32.1,
        "end_time": 36.5,
        "speaker_id": "Speaker_1",
        "speaker_role": "patient",
        "text": "D\u1ea1 kh\u00f4ng s\u1ed1t cao, kh\u00f4ng n\u00f4n ra m\u00e1u. Em ch\u1ec9 h\u01a1i bu\u1ed3n n\u00f4n th\u00f4i.",
        "confidence": 1.0,
        "audio_span": {
            "start_time": 32.1,
            "end_time": 36.5
        },
        "created_at": "2026-06-02T00:00:00+07:00",
        "version": "v0.1.0"
    },
    {
        "segment_id": "seg_011",
        "encounter_id": "SYN_OUT_002",
        "start_time": 36.6,
        "end_time": 40.6,
        "speaker_id": "Speaker_0",
        "speaker_role": "doctor",
        "text": "Tr\u01b0\u1edbc khi b\u1ecb \u0111au b\u1ee5ng ch\u1ecb c\u00f3 \u0103n \u0111\u1ed3 l\u1ea1 ho\u1eb7c \u0103n ngo\u00e0i kh\u00f4ng?",
        "confidence": 1.0,
        "audio_span": {
            "start_time": 36.6,
            "end_time": 40.6
        },
        "created_at": "2026-06-02T00:00:00+07:00",
        "version": "v0.1.0"
    },
    {
        "segment_id": "seg_012",
        "encounter_id": "SYN_OUT_002",
        "start_time": 40.7,
        "end_time": 44.8,
        "speaker_id": "Speaker_1",
        "speaker_role": "patient",
        "text": "D\u1ea1 h\u00f4m tr\u01b0\u1edbc em c\u00f3 \u0103n h\u1ea3i s\u1ea3n \u1edf ngo\u00e0i v\u1edbi b\u1ea1n.",
        "confidence": 1.0,
        "audio_span": {
            "start_time": 40.7,
            "end_time": 44.8
        },
        "created_at": "2026-06-02T00:00:00+07:00",
        "version": "v0.1.0"
    },
    {
        "segment_id": "seg_013",
        "encounter_id": "SYN_OUT_002",
        "start_time": 44.9,
        "end_time": 49.5,
        "speaker_id": "Speaker_0",
        "speaker_role": "doctor",
        "text": "Ch\u1ecb c\u00f3 d\u1ea5u hi\u1ec7u kh\u00e1t nhi\u1ec1u, ch\u00f3ng m\u1eb7t ho\u1eb7c ti\u1ec3u \u00edt h\u01a1n b\u00ecnh th\u01b0\u1eddng kh\u00f4ng?",
        "confidence": 1.0,
        "audio_span": {
            "start_time": 44.9,
            "end_time": 49.5
        },
        "created_at": "2026-06-02T00:00:00+07:00",
        "version": "v0.1.0"
    },
    {
        "segment_id": "seg_014",
        "encounter_id": "SYN_OUT_002",
        "start_time": 49.6,
        "end_time": 54.8,
        "speaker_id": "Speaker_1",
        "speaker_role": "patient",
        "text": "D\u1ea1 em h\u01a1i kh\u00e1t n\u01b0\u1edbc h\u01a1n, nh\u01b0ng ch\u01b0a ch\u00f3ng m\u1eb7t v\u00e0 v\u1eabn \u0111i ti\u1ec3u b\u00ecnh th\u01b0\u1eddng.",
        "confidence": 1.0,
        "audio_span": {
            "start_time": 49.6,
            "end_time": 54.8
        },
        "created_at": "2026-06-02T00:00:00+07:00",
        "version": "v0.1.0"
    },
    {
        "segment_id": "seg_015",
        "encounter_id": "SYN_OUT_002",
        "start_time": 54.9,
        "end_time": 70.0,
        "speaker_id": "Speaker_0",
        "speaker_role": "doctor",
        "text": "Tr\u01b0\u1edbc m\u1eaft ch\u1ecb c\u1ea7n u\u1ed1ng \u0111\u1ee7 n\u01b0\u1edbc, c\u00f3 th\u1ec3 d\u00f9ng dung d\u1ecbch b\u00f9 n\u01b0\u1edbc n\u1ebfu \u0111i ngo\u00e0i nhi\u1ec1u. Ch\u1ecb theo d\u00f5i th\u00eam. N\u1ebfu \u0111au b\u1ee5ng t\u0103ng, s\u1ed1t cao, n\u00f4n nhi\u1ec1u, \u0111i ngo\u00e0i ra m\u00e1u ho\u1eb7c c\u00f3 d\u1ea5u hi\u1ec7u m\u1ea5t n\u01b0\u1edbc th\u00ec c\u1ea7n quay l\u1ea1i kh\u00e1m ngay.",
        "confidence": 1.0,
        "audio_span": {
            "start_time": 54.9,
            "end_time": 70.0
        },
        "created_at": "2026-06-02T00:00:00+07:00",
        "version": "v0.1.0"
    },
    {
        "segment_id": "seg_016",
        "encounter_id": "SYN_OUT_002",
        "start_time": 70.1,
        "end_time": 73.0,
        "speaker_id": "Speaker_1",
        "speaker_role": "patient",
        "text": "D\u1ea1 v\u00e2ng, em s\u1ebd theo d\u00f5i th\u00eam.",
        "confidence": 1.0,
        "audio_span": {
            "start_time": 70.1,
            "end_time": 73.0
        },
        "created_at": "2026-06-02T00:00:00+07:00",
        "version": "v0.1.0"
    }
]