[
    {
        "segment_id": "seg_001",
        "encounter_id": "SYN_OUT_004",
        "start_time": 0.0,
        "end_time": 3.0,
        "speaker_id": "Speaker_0",
        "speaker_role": "doctor",
        "text": "Chào anh, hôm nay anh thấy khó chịu ở đâu?",
        "confidence": 1.0,
        "audio_span": {
            "start_time": 0.0,
            "end_time": 3.0
        },
        "created_at": "2026-06-03T00:00:00+07:00",
        "version": "v0.1.0"
    },
    {
        "segment_id": "seg_002",
        "encounter_id": "SYN_OUT_004",
        "start_time": 3.1,
        "end_time": 7.4,
        "speaker_id": "Speaker_0",
        "speaker_role": "doctor",
        "text": "Dạ em bị đau họng và ho nhẹ khoảng hai ngày nay.",
        "confidence": 1.0,
        "audio_span": {
            "start_time": 3.1,
            "end_time": 7.4
        },
        "created_at": "2026-06-03T00:00:00+07:00",
        "version": "v0.1.0"
    },
    {
        "segment_id": "seg_003",
        "encounter_id": "SYN_OUT_004",
        "start_time": 7.5,
        "end_time": 9.0,
        "speaker_id": "Speaker_0",
        "speaker_role": "doctor",
        "text": "Anh có sốt không?",
        "confidence": 1.0,
        "audio_span": {
            "start_time": 7.5,
            "end_time": 9.0
        },
        "created_at": "2026-06-03T00:00:00+07:00",
        "version": "v0.1.0"
    },
    {
        "segment_id": "seg_004",
        "encounter_id": "SYN_OUT_004",
        "start_time": 9.1,
        "end_time": 12.8,
        "speaker_id": "Speaker_0",
        "speaker_role": "doctor",
        "text": "Dạ em chỉ hơi ấm người, chưa đo thấy sốt cao.",
        "confidence": 1.0,
        "audio_span": {
            "start_time": 9.1,
            "end_time": 12.8
        },
        "created_at": "2026-06-03T00:00:00+07:00",
        "version": "v0.1.0"
    },
    {
        "segment_id": "seg_005",
        "encounter_id": "SYN_OUT_004",
        "start_time": 12.9,
        "end_time": 16.0,
        "speaker_id": "Speaker_0",
        "speaker_role": "doctor",
        "text": "Anh có đau ngực hoặc khó thở không?",
        "confidence": 1.0,
        "audio_span": {
            "start_time": 12.9,
            "end_time": 16.0
        },
        "created_at": "2026-06-03T00:00:00+07:00",
        "version": "v0.1.0"
    },
    {
        "segment_id": "seg_006",
        "encounter_id": "SYN_OUT_004",
        "start_time": 16.1,
        "end_time": 20.0,
        "speaker_id": "Speaker_0",
        "speaker_role": "doctor",
        "text": "Dạ không, em không đau ngực và không khó thở.",
        "confidence": 1.0,
        "audio_span": {
            "start_time": 16.1,
            "end_time": 20.0
        },
        "created_at": "2026-06-03T00:00:00+07:00",
        "version": "v0.1.0"
    },
    {
        "segment_id": "seg_007",
        "encounter_id": "SYN_OUT_004",
        "start_time": 20.1,
        "end_time": 24.0,
        "speaker_id": "Speaker_0",
        "speaker_role": "doctor",
        "text": "Anh có khạc đờm vàng xanh hoặc ho ra máu không?",
        "confidence": 1.0,
        "audio_span": {
            "start_time": 20.1,
            "end_time": 24.0
        },
        "created_at": "2026-06-03T00:00:00+07:00",
        "version": "v0.1.0"
    },
    {
        "segment_id": "seg_008",
        "encounter_id": "SYN_OUT_004",
        "start_time": 24.1,
        "end_time": 28.0,
        "speaker_id": "Speaker_0",
        "speaker_role": "doctor",
        "text": "Dạ không, em không ho ra máu. Đờm cũng không nhiều.",
        "confidence": 1.0,
        "audio_span": {
            "start_time": 24.1,
            "end_time": 28.0
        },
        "created_at": "2026-06-03T00:00:00+07:00",
        "version": "v0.1.0"
    },
    {
        "segment_id": "seg_009",
        "encounter_id": "SYN_OUT_004",
        "start_time": 28.1,
        "end_time": 31.0,
        "speaker_id": "Speaker_0",
        "speaker_role": "doctor",
        "text": "Trước đây anh có dị ứng thuốc gì không?",
        "confidence": 1.0,
        "audio_span": {
            "start_time": 28.1,
            "end_time": 31.0
        },
        "created_at": "2026-06-03T00:00:00+07:00",
        "version": "v0.1.0"
    },
    {
        "segment_id": "seg_010",
        "encounter_id": "SYN_OUT_004",
        "start_time": 31.1,
        "end_time": 33.8,
        "speaker_id": "Speaker_0",
        "speaker_role": "doctor",
        "text": "Dạ em chưa từng dị ứng thuốc.",
        "confidence": 1.0,
        "audio_span": {
            "start_time": 31.1,
            "end_time": 33.8
        },
        "created_at": "2026-06-03T00:00:00+07:00",
        "version": "v0.1.0"
    },
    {
        "segment_id": "seg_011",
        "encounter_id": "SYN_OUT_004",
        "start_time": 33.9,
        "end_time": 36.0,
        "speaker_id": "Speaker_0",
        "speaker_role": "doctor",
        "text": "Anh đã uống thuốc gì chưa?",
        "confidence": 1.0,
        "audio_span": {
            "start_time": 33.9,
            "end_time": 36.0
        },
        "created_at": "2026-06-03T00:00:00+07:00",
        "version": "v0.1.0"
    },
    {
        "segment_id": "seg_012",
        "encounter_id": "SYN_OUT_004",
        "start_time": 36.1,
        "end_time": 40.0,
        "speaker_id": "Speaker_0",
        "speaker_role": "doctor",
        "text": "Em mới ngậm viên ngậm đau họng, chưa uống kháng sinh.",
        "confidence": 1.0,
        "audio_span": {
            "start_time": 36.1,
            "end_time": 40.0
        },
        "created_at": "2026-06-03T00:00:00+07:00",
        "version": "v0.1.0"
    },
    {
        "segment_id": "seg_013",
        "encounter_id": "SYN_OUT_004",
        "start_time": 40.1,
        "end_time": 59.0,
        "speaker_id": "Speaker_0",
        "speaker_role": "doctor",
        "text": "Hiện tại anh theo dõi thêm, uống đủ nước, súc họng nước muối ấm. Nếu sốt cao, khó thở, đau ngực hoặc ho ra máu thì cần quay lại khám ngay.",
        "confidence": 1.0,
        "audio_span": {
            "start_time": 40.1,
            "end_time": 59.0
        },
        "created_at": "2026-06-03T00:00:00+07:00",
        "version": "v0.1.0"
    },
    {
        "segment_id": "seg_014",
        "encounter_id": "SYN_OUT_004",
        "start_time": 59.1,
        "end_time": 63.0,
        "speaker_id": "Speaker_0",
        "speaker_role": "doctor",
        "text": "Dạ vâng, em cảm ơn bác sĩ.",
        "confidence": 1.0,
        "audio_span": {
            "start_time": 59.1,
            "end_time": 63.0
        },
        "created_at": "2026-06-03T00:00:00+07:00",
        "version": "v0.1.0"
    }
]